Settimana,Premio,Traguardo
1,Urban public transport monthly personal pass,first place in weekly green leaves leaderboard
1,Guided tour in Ferrara,first draw in the Top 50 of green leaves weekly leaderboard
1,Landscape Metropolis bag in recycled cotton,second draw in the Top 50 of green leaves weekly leaderboard
2,SPAL third shirt,first place in weekly green leaves leaderboard
2,Landscape Metropolis bag + canteen,first draw in the Top 50 of green leaves weekly leaderboard
2,2 reduced cinema tickets + 4 pizza slices,second draw in the Top 50 of green leaves weekly leaderboard
3,Cloister Art Gallery annual card SUPPORTING,first place in weekly green leaves leaderboard
3,SPAL third shirt,first draw in the Top 50 of green leaves weekly leaderboard
3,Landscape Metropolis bag + 2 pizza slices,second draw in the Top 50 of green leaves weekly leaderboard